<?xml version="1.0"?>
<!DOCTYPE items [
<!ELEMENT items (item*)>
<!ATTLIST items burpVersion CDATA "">
<!ATTLIST items exportTime CDATA "">
<!ELEMENT item (time, url, host, port, protocol, method, path, extension, request, status, responselength, mimetype, response, comment)>
<!ELEMENT time (#PCDATA)>
<!ELEMENT url (#PCDATA)>
<!ELEMENT host (#PCDATA)>
<!ATTLIST host ip CDATA "">
<!ELEMENT port (#PCDATA)>
<!ELEMENT protocol (#PCDATA)>
<!ELEMENT method (#PCDATA)>
<!ELEMENT path (#PCDATA)>
<!ELEMENT extension (#PCDATA)>
<!ELEMENT request (#PCDATA)>
<!ATTLIST request base64 (true|false) "false">
<!ELEMENT status (#PCDATA)>
<!ELEMENT responselength (#PCDATA)>
<!ELEMENT mimetype (#PCDATA)>
<!ELEMENT response (#PCDATA)>
<!ATTLIST response base64 (true|false) "false">
<!ELEMENT comment (#PCDATA)>
]>
<items burpVersion="2023.6.2" exportTime="Mon Jul 10 12:54:57 PKT 2023">
  <item>
    <time>Mon Jul 10 12:43:55 PKT 2023</time>
    <url><![CDATA[https://api.coinmarketcap.com/data-api/v3/cryptocurrency/detail/chart?id=1&range=ALL]]></url>
    <host ip="108.139.79.13">api.coinmarketcap.com</host>
    <port>443</port>
    <protocol>https</protocol>
    <method><![CDATA[GET]]></method>
    <path><![CDATA[/data-api/v3/cryptocurrency/detail/chart?id=1&range=ALL]]></path>
    <extension>null</extension>
    <request base64="true"><![CDATA[R0VUIC9kYXRhLWFwaS92My9jcnlwdG9jdXJyZW5jeS9kZXRhaWwvY2hhcnQ/aWQ9MSZyYW5nZT1BTEwgSFRUUC8yDQpIb3N0OiBhcGkuY29pbm1hcmtldGNhcC5jb20NClNlYy1DaC1VYTogDQpTZWMtQ2gtVWEtTW9iaWxlOiA/MA0KVXNlci1BZ2VudDogTW96aWxsYS81LjAgKFdpbmRvd3MgTlQgMTAuMDsgV2luNjQ7IHg2NCkgQXBwbGVXZWJLaXQvNTM3LjM2IChLSFRNTCwgbGlrZSBHZWNrbykgQ2hyb21lLzExNC4wLjU3MzUuMTk5IFNhZmFyaS81MzcuMzYNCkFjY2VwdDogYXBwbGljYXRpb24vanNvbiwgdGV4dC9wbGFpbiwgKi8qDQpDYWNoZS1Db250cm9sOiBuby1jYWNoZQ0KUGxhdGZvcm06IHdlYg0KWC1SZXF1ZXN0LUlkOiBkMTBjMzJhYjVhZjE0NTIwYTg4OTI4OGNkMjFmZmU0MA0KU2VjLUNoLVVhLVBsYXRmb3JtOiAiIg0KT3JpZ2luOiBodHRwczovL2NvaW5tYXJrZXRjYXAuY29tDQpTZWMtRmV0Y2gtU2l0ZTogc2FtZS1zaXRlDQpTZWMtRmV0Y2gtTW9kZTogY29ycw0KU2VjLUZldGNoLURlc3Q6IGVtcHR5DQpSZWZlcmVyOiBodHRwczovL2NvaW5tYXJrZXRjYXAuY29tLw0KQWNjZXB0LUVuY29kaW5nOiBnemlwLCBkZWZsYXRlDQpBY2NlcHQtTGFuZ3VhZ2U6IGVuLVVTLGVuO3E9MC45DQoNCg==]]></request>
    <status>200</status>
    <responselength>110992</responselength>
    <mimetype>JSON</mimetype>
    <response base64="true"><![CDATA[SFRUUC8yIDIwMCBPSw0KQ29udGVudC1UeXBlOiBhcHBsaWNhdGlvbi9qc29uDQpDb250ZW50LUxlbmd0aDogMTA5ODMxDQpEYXRlOiBNb24sIDEwIEp1bCAyMDIzIDA3OjQwOjA0IEdNVA0KU2VydmVyOiBUZW5naW5lDQpYLUVudm95LVVwc3RyZWFtLVNlcnZpY2UtVGltZTogMjMNClgtUmVxdWVzdC1JZDogYjAzNjhlMjFlMzY0NDc3ZjkyODkxYTk4ZjJlYmYwN2YNClgtRW52b3ktRGVjb3JhdG9yLU9wZXJhdGlvbjogY21jLWdhdGV3YXktc2VydmljZS5jbWMtYmFja2VuZC5zdmMuY2x1c3Rlci5sb2NhbDo5OTk5LyoNCkFjY2Vzcy1Db250cm9sLUFsbG93LU9yaWdpbjogaHR0cHM6Ly9jb2lubWFya2V0Y2FwLmNvbQ0KQWNjZXNzLUNvbnRyb2wtQWxsb3ctQ3JlZGVudGlhbHM6IHRydWUNCkFjY2Vzcy1Db250cm9sLUFsbG93LUhlYWRlcnM6IG9yaWdpbix4LWNzcmYtdG9rZW4sYWNjZXB0LEROVCxYLUN1c3RvbUhlYWRlcixLZWVwLUFsaXZlLFVzZXItQWdlbnQsWC1SZXF1ZXN0ZWQtV2l0aCxJZi1Nb2RpZmllZC1TaW5jZSxDYWNoZS1Db250cm9sLENvbnRlbnQtVHlwZSxBdXRob3JpemF0aW9uLGZ2aWRlby1pZCx4LXJlcXVlc3QtaWQsYXV0aEhlYWRlcixhY2NlcHQtbGFuZ3VhZ2UsY21jLWNhcHRjaGEtdG9rZW4sUGxhdGZvcm0sc2VjdXJpdHktaWQseC1zZS1iaCx4LXNlLXBkLHgtc2UtcmQseC1zZS1zZCx4LXNlLWdzZCx4LXNlLWdkLGRldmljZS1pbmZvLHgtcHdkLWVuY3J5cHRpb24sZGV2aWNlTW9kZWwsZGV2aWNlSWQsZGV2aWNlTmFtZSxsYW5ndWFnZUNvZGUNCkFjY2Vzcy1Db250cm9sLUFsbG93LU1ldGhvZHM6IE9QVElPTlMsIEhFQUQsIEdFVCwgUE9TVCwgUFVULCBERUxFVEUsIFBBVENIDQpBY2Nlc3MtQ29udHJvbC1FeHBvc2UtSGVhZGVyczogQXV0aG9yaXphdGlvbix4LWNhY2hlLGMtYmFja2VuZC1jYWNoZQ0KQWNjZXNzLUNvbnRyb2wtTWF4LUFnZTogNjAwDQpYLUNhY2hlOiBIaXQgZnJvbSBjbG91ZGZyb250DQpWaWE6IDEuMSA2YzBlYjczNWIzYzNlZDZiMTRkYzdkYzY1NDNlMWFmMi5jbG91ZGZyb250Lm5ldCAoQ2xvdWRGcm9udCkNClgtQW16LUNmLVBvcDogRFhCNTMtUDENClgtQW16LUNmLUlkOiBJWjhTQlBKTXlqZ2NjYmtLV2N4UEw4VWFCSlZHWUtxWnZBbVB2Z053SWVSeTd6a2ViV3A4N2c9PQ0KQWdlOiAyMzUNCg0KeyJkYXRhIjp7InBvaW50cyI6eyIxMjc4OTc5MjAwIjp7InYiOlswLjA2MTgzMzMyLDc1LjQyLDIwNjc4My43OTI1NzcxNiwxLDMzNDQyMTMuMDAwMDAwMDAwMDAwMDAwMDAwMDBdLCJjIjpbMC4wNjE4MzMzMiw3NS40MiwyMDY3ODMuNzkyNTc3MTZdfSwiMTI3OTU4NDAwMCI6eyJ2IjpbMC4wNzQxMzU4OCwyNjIuMzUsMjU2ODYwLjQzNjgzMzAwLDEsMzQ2NDcyNS4wMDAwMDAwMDAwMDAwMDAwMDAwMF0sImMiOlswLjA3NDEzNTg4LDI2Mi4zNSwyNTY4NjAuNDM2ODMzMDBdfSwiMTI4MDE4ODgwMCI6eyJ2IjpbMC4wNjI5NDQ4MywzMzcwLjksMjIyNTExLjU0NzY3MDc1LDEsMzUzNTAyNS4wMDAwMDAwMDAwMDAwMDAwMDAwMF0sImMiOlswLjA2Mjk0NDgzLDMzNzAuOSwyMjI1MTEuNTQ3NjcwNzVdfSwiMTI4MDc5MzYwMCI6eyJ2IjpbMC4wNTk5ODUxOSw5ODU2LjM2LDIxNjM0NC4wODU4ODM3NSwxLDM2MDY2MjUuMDAwMDAwMDAwMDAwMDAwMDAwMDBdLCJjIjpbMC4wNTk5ODUxOSw5ODU2LjM2LDIxNjM0NC4wODU4ODM3NV19LCIxMjgxMzk4NDAwIjp7InYiOlswLjA2NjEyOTc4LDEzMDQuNzUsMjQyOTQ1LjkzMjUxOTUwLDEsMzY3Mzc3NS4wMDAwMDAwMDAwMDAwMDAwMDAwMF0sImMiOlswLjA2NjEyOTc4LDEzMDQuNzUsMjQyOTQ1LjkzMjUxOTUwXX0sIjEyODE5MTY4MDAiOnsidiI6WzAuMDc3NDU4NDksMTA2NzguMjMsMjg5NTk5Ljg2NTk0OTc1LDEsMzczODc3NS4wMDAwMDAwMDAwMDAwMDAwMDAwMF0sImMiOlswLjA3NzQ1ODQ5LDEwNjc4LjIzLDI4OTU5OS44NjU5NDk3NV19LCIxMjgyNTIxNjAwIjp7InYiOlswLjA2NzgyOTA2LDQzMDUuMTYsMjU3NjI2LjYzOTk2NTUwLDEsMzc5ODE3NS4wMDAwMDAwMDAwMDAwMDAwMDAwMF0sImMiOlswLjA2NzgyOTA2LDQzMDUuMTYsMjU3NjI2LjYzOTk2NTUwXX0sIjEyODMxMjY0MDAiOnsidiI6WzAuMDYwNzE4MTgsMzQxMjAuMzIsMjM0NTQyLjQyODU3NjcyLDEsMzg2MjgwNC4wMDAwMDAwMDAwMDAwMDAwMDAwMF0sImMiOlswLjA2MDcxODE4LDM0MTIwLjMyLDIzNDU0Mi40Mjg1NzY3Ml19LCIxMjgzNzMxMjAwIjp7InYiOlswLjA2MDM4MTEyLDkxMS4yMywyMzY3NTguOTAwMTA0MDAsMSwzOTIxMDc1LjAwMDAwMDAwMDAwMDAwMDAwMDAwXSwiYyI6WzAuMDYwMzgxMTIsOTExLjIzLDIzNjc1OC45MDAxMDQwMF19LCIxMjg0MzM2MDAwIjp7InYiOlswLjA2MDExNDE2LDEwMDUwLjU2LDIzOTE1MC42NTk4NzQwMCwxLDM5NzgyNzUuMDAwMDAwMDAwMDAwMDAwMDAwMDBdLCJjIjpbMC4wNjAxMTQxNiwxMDA1MC41NiwyMzkxNTAuNjU5ODc0MDBdfSwiMTI4NDg1NDQwMCI6eyJ2IjpbMC4wNjA3MTk4NywxMjkxNy41MiwyNDUzNDMuMTg4NzI1MjUsMSw0MDQwNTc1LjAwMDAwMDAwMDAwMDAwMDAwMDAwXSwiYyI6WzAuMDYwNzE5ODcsMTI5MTcuNTIsMjQ1MzQzLjE4ODcyNTI1XX0sIjEyODU0NTkyMDAiOnsidiI6WzAuMDYwNjk5MjksMTIwNDYuNjUsMjQ5NTc4Ljc4ODE3NTI1LDEsNDExMTcyNS4wMDAwMDAwMDAwMDAwMDAwMDAwMF0sImMiOlswLjA2MDY5OTI5LDEyMDQ2LjY1LDI0OTU3OC43ODgxNzUyNV19LCIxMjg2MDY0MDAwIjp7InYiOlswLjA2MDEzODQ0LDcxNzcuMDQsMjUwNjYxLjUyODMwMzAwLDEsNDE2ODA3NS4wMDAwMDAwMDAwMDAwMDAwMDAwMF0sImMiOlswLjA2MDEzODQ0LDcxNzcuMDQsMjUwNjYxLjUyODMwMzAwXX0sIjEyODY2Njg4MDAiOnsidiI6WzAuMDk4NzMzNDUsNTA0ODUuNTcsNDE2OTUzLjgyNzY4NjI1LDEsNDIyMzAyNS4wMDAwMDAwMDAwMDAwMDAwMDAwMF0sImMiOlswLjA5ODczMzQ1LDUwNDg1LjU3LDQxNjk1My44Mjc2ODYyNV19LCIxMjg3MTg3MjAwIjp7InYiOlswLjEwNjAyMzE2LDYyNzUuOTksNDUzNzI5LjYxMTk4NDI4LDEsNDI3OTUzMy4wMDAwMDAwMDAwMDAwMDAwMDAwMF0sImMiOlswLjEwNjAyMzE2LDYyNzUuOTksNDUzNzI5LjYxMTk4NDI4XX0sIjEyODc3OTIwMDAiOnsidiI6WzAuMTA5NTkzNDEsNDQwMC40Myw0Nzc1MjguNjI1NTU3NzUsMSw0MzU3Mjc1LjAwMDAwMDAwMDAwMDAwMDAwMDAwXSwiYyI6WzAuMTA5NTkzNDEsNDQwMC40Myw0Nzc1MjguNjI1NTU3NzVdfSwiMTI4ODM5NjgwMCI6eyJ2IjpbMC4xOTAwODY2OSwyNjU4Ni41LDg0MzA0OC43MjY2NTE3NSwxLDQ0MzUwNzUuMDAwMDAwMDAwMDAwMDAwMDAwMDBdLCJjIjpbMC4xOTAwODY2OSwyNjU4Ni41LDg0MzA0OC43MjY2NTE3NV19LCIxMjg5MDAxNjAwIjp7InYiOlswLjI0NzEzNTQ4LDMyNzE0LjYxLDExMTI4NTMuMDQzNTIzODQsMSw0NTAzMDA4LjAwMDAwMDAwMDAwMDAwMDAwMDAwXSwiYyI6WzAuMjQ3MTM1NDgsMzI3MTQuNjEsMTExMjg1My4wNDM1MjM4NF19LCIxMjg5NjA2NDAwIjp7InYiOlswLjI1ODM4MTY1LDIxOTM3LjY3LDExODM0OTcuNzY5MjAxMjUsMSw0NTgwNDI1LjAwMDAwMDAwMDAwMDAwMDAwMDAwXSwiYyI6WzAuMjU4MzgxNjUsMjE5MzcuNjcsMTE4MzQ5Ny43NjkyMDEyNV19LCIxMjkwMTI0ODAwIjp7InYiOlswLjI3ODg4MTgyLDIxNTEuODMsMTI5NTYyMi4xODczMTA1MCwxLDQ2NDU3NzUuMDAwMDAwMDAwMDAwMDAwMDAwMDBdLCJjIjpbMC4yNzg4ODE4MiwyMTUxLjgzLDEyOTU2MjIuMTg3MzEwNTBdfSwiMTI5MDcyOTYwMCI6eyJ2IjpbMC4yODAwMTY2NSwzMzcxOS4xMSwxMzE2NDQyLjI3NjY0NTAwLDEsNDcwMTMwMC4wMDAwMDAwMDAwMDAwMDAwMDAwMF0sImMiOlswLjI4MDAxNjY1LDMzNzE5LjExLDEzMTY0NDIuMjc2NjQ1MDBdfSwiMTI5MTMzNDQwMCI6eyJ2IjpbMC4yNDA0MzAwNCwyNTY2LjI1LDExNDYzMDQuMzEyNDU5MDAsMSw0NzY3NzI1LjAwMDAwMDAwMDAwMDAwMDAwMDAwXSwiYyI6WzAuMjQwNDMwMDQsMjU2Ni4yNSwxMTQ2MzA0LjMxMjQ1OTAwXX0sIjEyOTE5MzkyMDAiOnsidiI6WzAuMjEzMjQ2MzQsMTY4MC41LDEwMzMyOTAuNDcxNjI4NTAsMSw0ODQ1NTI1LjAwMDAwMDAwMDAwMDAwMDAwMDAwXSwiYyI6WzAuMjEzMjQ2MzQsMTY4MC41LDEwMzMyOTAuNDcxNjI4NTBdfSwiMTI5MjQ1NzYwMCI6eyJ2IjpbMC4yMzcwNjY5NiwxNDMzNi44MSwxMTYwODczLjUxOTg2NjMyLDEsNDg5NjgxNy4wMDAwMDAwMDAwMDAwMDAwMDAwMF0sImMiOlswLjIzNzA2Njk2LDE0MzM2LjgxLDExNjA4NzMuNTE5ODY2MzJdfSwiMTI5MzA2MjQwMCI6eyJ2IjpbMC4yNjgzNjIyLDg2NDEuNTcsMTMyOTgwOC41MDA2MDUwLDEsNDk1NTI3NS4wMDAwMDAwMDAwMDAwMDAwMDAwMF0sImMiOlswLjI2ODM2MjIsODY0MS41NywxMzI5ODA4LjUwMDYwNTBdfSwiMTI5MzY2NzIwMCI6eyJ2IjpbMC4yOTU1NzE4OSwyNTQwLjI0LDE0ODEzMzQuMTkzMTM4ODQsMSw1MDExNzU2LjAwMDAwMDAwMDAwMDAwMDAwMDAwXSwiYyI6WzAuMjk1NTcxODksMjU0MC4yNCwxNDgxMzM0LjE5MzEzODg0XX0sIjEyOTQyNzIwMDAiOnsidiI6WzAuMjk5MTg1ODcsMzQ0NS4wOCwxNTE2MDU3LjA3OTQwNDI1LDEsNTA2NzI3NS4wMDAwMDAwMDAwMDAwMDAwMDAwMF0sImMiOlswLjI5OTE4NTg3LDM0NDUuMDgsMTUxNjA1Ny4wNzk0MDQyNV19LCIxMjk0ODc2ODAwIjp7InYiOlswLjMzMDQzODQ5LDIwMTE2LjM0LDE2OTQwMTcuNzAxODcxNzUsMSw1MTI2NTc1LjAwMDAwMDAwMDAwMDAwMDAwMDAwXSwiYyI6WzAuMzMwNDM4NDksMjAxMTYuMzQsMTY5NDAxNy43MDE4NzE3NV19LCIxMjk1Mzk1MjAwIjp7InYiOlswLjMxODU2MjkyLDcyODUuOCwxNjQ5MTEyLjYzMjAzNzAwLDEsNTE3NjcyNS4wMDAwMDAwMDAwMDAwMDAwMDAwMF0sImMiOlswLjMxODU2MjkyLDcyODUuOCwxNjQ5MTEyLjYzMjAzNzAwXX0sIjEyOTYwMDAwMDAiOnsidiI6WzAuNDI2MDE0NSwxNTU1MC45MSwyMjMxMzI1LjQ5NjI4NzUsMSw1MjM3Njc1LjAwMDAwMDAwMDAwMDAwMDAwMDAwXSwiYyI6WzAuNDI2MDE0NSwxNTU1MC45MSwyMjMxMzI1LjQ5NjI4NzVdfSwiMTI5NjYwNDgwMCI6eyJ2IjpbMC42OTI4NDkyNiw1NjAwLjE0LDM2Njc5NjEuMzAzNjcxNTAsMSw1Mjk0MDI1LjAwMDAwMDAwMDAwMDAwMDAwMDAwXSwiYyI6WzAuNjkyODQ5MjYsNTYwMC4xNCwzNjY3OTYxLjMwMzY3MTUwXX0sIjEyOTcyMDk2MDAiOnsidiI6WzAuOTE1ODMxMTMsNDk3MDIuNzksNDkwNjcwMi42NTM2NDQ1MCwxLDUzNTc2NTAuMDAwMDAwMDAwMDAwMDAwMDAwMDBdLCJjIjpbMC45MTU4MzExMyw0OTcwMi43OSw0OTA2NzAyLjY1MzY0NDUwXX0sIjEyOTc3MjgwMDAiOnsidiI6WzEuMDc4MzEzNSw4NjA1LjcsNTg0MTE5Ny4yNzE2NjI1LDEsNTQxNjk3NS4wMDAwMDAwMDAwMDAwMDAwMDAwMF0sImMiOlsxLjA3ODMxMzUsODYwNS43LDU4NDExOTcuMjcxNjYyNV19LCIxMjk4MzMyODAwIjp7InYiOlswLjkxMzg3MzEyLDEyMDY4LjU4LDUwMTYyMjYuNzA4ODUyMDAsMSw1NDg4OTc1LjAwMDAwMDAwMDAwMDAwMDAwMDAwXSwiYyI6WzAuOTEzODczMTIsMTIwNjguNTgsNTAxNjIyNi43MDg4NTIwMF19LCIxMjk4OTM3NjAwIjp7InYiOlswLjg2NzM4NjYxLDIyNjAzLjE0LDQ4MjUwMzMuMTgwMTEyMjUsMSw1NTYyNzI1LjAwMDAwMDAwMDAwMDAwMDAwMDAwXSwiYyI6WzAuODY3Mzg2NjEsMjI2MDMuMTQsNDgyNTAzMy4xODAxMTIyNV19LCIxMjk5NTQyNDAwIjp7InYiOlswLjg4NzUyNDU0LDQ1MzQuNzcsNTAwNDY4NC4zMTY3MTk1MCwxLDU2Mzg5MjUuMDAwMDAwMDAwMDAwMDAwMDAwMDBdLCJjIjpbMC44ODc1MjQ1NCw0NTM0Ljc3LDUwMDQ2ODQuMzE2NzE5NTBdfSwiMTMwMDE0NzIwMCI6eyJ2IjpbMC45MDY0ODI2OSwyNzMzLjYsNTE1MTUxOC40NjUyMDI3NSwxLDU2ODI5NzUuMDAwMDAwMDAwMDAwMDAwMDAwMDBdLCJjIjpbMC45MDY0ODI2OSwyNzMzLjYsNTE1MTUxOC40NjUyMDI3NV19LCIxMzAwNjY1NjAwIjp7InYiOlswLjgxMDYxNzIzLDM3MDkuOTMsNDYzOTAyMC41NDkyNzQ3NSwxLDU3MjI4MjUuMDAwMDAwMDAwMDAwMDAwMDAwMDBdLCJjIjpbMC44MTA2MTcyMywzNzA5LjkzLDQ2MzkwMjAuNTQ5Mjc0NzVdfSwiMTMwMTI3MDQwMCI6eyJ2IjpbMC44ODcyMjA0NSwxMjYxNi45NCw1MTIzOTg2LjQ0NTM5NjI1LDEsNTc3NTMyNS4wMDAwMDAwMDAwMDAwMDAwMDAwMF0sImMiOlswLjg4NzIyMDQ1LDEyNjE2Ljk0LDUxMjM5ODYuNDQ1Mzk2MjVdfSwiMTMwMTg3NTIwMCI6eyJ2IjpbMC43ODkxMzUxMSwzMTE1MC4wNCw0NjA1ODA1LjIxOTYyMjUzLDEsNTgzNjUyMy4wMDAwMDAwMDAwMDAwMDAwMDAwMF0sImMiOlswLjc4OTEzNTExLDMxMTUwLjA0LDQ2MDU4MDUuMjE5NjIyNTNdfSwiMTMwMjQ4MDAwMCI6eyJ2IjpbMC43NjE3NzY3MiwxNDU5OC4yLDQ0ODk5MzcuMTI2MzExNzYsMSw1ODk0MDMzLjAwMDAwMDAwMDAwMDAwMDAwMDAwXSwiYyI6WzAuNzYxNzc2NzIsMTQ1OTguMiw0NDg5OTM3LjEyNjMxMTc2XX0sIjEzMDI5OTg0MDAiOnsidiI6WzEuMDY2Njg0MDgsMjQwNDMuMDQsNjM0MDgyMy41MTIyNTQwMCwxLDU5NDQ0MjUuMDAwMDAwMDAwMDAwMDAwMDAwMDBdLCJjIjpbMS4wNjY2ODQwOCwyNDA0My4wNCw2MzQwODIzLjUxMjI1NDAwXX0sIjEzMDM2MDMyMDAiOnsidiI6WzEuNDUxMDk3NzEsMjE1NzMuMjksODcwNTk2OS41NDM0NzMyNSwxLDU5OTk1NzUuMDAwMDAwMDAwMDAwMDAwMDAwMDBdLCJjIjpbMS40NTEwOTc3MSwyMTU3My4yOSw4NzA1OTY5LjU0MzQ3MzI1XX0sIjEzMDQyMDgwMDAiOnsidiI6WzMuNDQ0MDA3ODYsNDU5NjMuNjksMjA4ODY3ODguMzY4MzQ1NTAsMSw2MDY0Njc1LjAwMDAwMDAwMDAwMDAwMDAwMDAwXSwiYyI6WzMuNDQ0MDA3ODYsNDU5NjMuNjksMjA4ODY3ODguMzY4MzQ1NTBdfSwiMTMwNDgxMjgwMCI6eyJ2IjpbMy42MzUxMTQwOSwyMTAzNS4yLDIyMzExMTQ4Ljg3MjM0MDc1LDEsNjEzNzY3NS4wMDAwMDAwMDAwMDAwMDAwMDAwMF0sImMiOlszLjYzNTExNDA5LDIxMDM1LjIsMjIzMTExNDguODcyMzQwNzVdfSwiMTMwNTQxNzYwMCI6eyJ2IjpbNy42Nzg5ODM3NSwxODI3Mi43NSw0NzY4ODIxNi44NTg4NDM3NSwxLDYyMTAyMjUuMDAwMDAwMDAwMDAwMDAwMDAwMDBdLCJjIjpbNy42Nzg5ODM3NSwxODI3Mi43NSw0NzY4ODIxNi44NTg4NDM3NV19LCIxMzA1OTM2MDAwIjp7InYiOls1LjcxOTc0NzQyLDMxMTYyLjk2LDM1OTIyMTU4LjcwMjg4MjUwLDEsNjI4MDM3NS4wMDAwMDAwMDAwMDAwMDAwMDAwMF0sImMiOls1LjcxOTc0NzQyLDMxMTYyLjk2LDM1OTIyMTU4LjcwMjg4MjUwXX0sIjEzMDY1NDA4MDAiOnsidiI6WzkuMTM4OTI1ODcsMTIyNzQuMTEsNTgyMDEwMjAuOTI5OTQ4MjUsMSw2MzY4NDc1LjAwMDAwMDAwMDAwMDAwMDAwMDAwXSwiYyI6WzkuMTM4OTI1ODcsMTIyNzQuMTEsNTgyMDEwMjAuOTI5OTQ4MjVdfSwiMTMwNzE0NTYwMCI6eyJ2IjpbMTMuMDgxMDIwMzgsNDQzNTEuOTYsODQxNDg1NjguOTc2OTkyNTAsMSw2NDMyODc1LjAwMDAwMDAwMDAwMDAwMDAwMDAwXSwiYyI6WzEzLjA4MTAyMDM4LDQ0MzUxLjk2LDg0MTQ4NTY4Ljk3Njk5MjUwXX0sIjEzMDc3NTA0MDAiOnsidiI6WzI2LjM1NDYxNTA4LDEyMjA3Ny42OSwxNzE1MDMzMTYuNDk4NDc3MDAsMSw2NTA3NTI1LjAwMDAwMDAwMDAwMDAwMDAwMDAwXSwiYyI6WzI2LjM1NDYxNTA4LDEyMjA3Ny42OSwxNzE1MDMzMTYuNDk4NDc3MDBdfSwiMTMwODI2ODgwMCI6eyJ2IjpbMTkuNzE2ODM0NDYsMTA4ODA5Ljk5LDEyOTY0MDY1MS4xNzg4MDc1MCwxLDY1NzUxMjUuMDAwMDAwMDAwMDAwMDAwMDAwMDBdLCJjIjpbMTkuNzE2ODM0NDYsMTA4ODA5Ljk5LDEyOTY0MDY1MS4xNzg4MDc1MF19LCIxMzA4ODczNjAwIjp7InYiOlsxNS40ODM0MzgwOCwwLDEwMzA2MjAyMS44MDU5NTIwMCwxLDY2NTYyNzUuMDAwMDAwMDAwMDAwMDAwMDAwMDBdLCJjIjpbMTUuNDgzNDM4MDgsMCwxMDMwNjIwMjEuODA1OTUyMDBdfSwiMTMwOTQ3ODQwMCI6eyJ2IjpbMTYuMTM5ODAxNjIsMzMyNTMuMiwxMDgzNjQ2NDUuNTUxODgyNTAsMSw2NzE0MTI1LjAwMDAwMDAwMDAwMDAwMDAwMDAwXSwiYyI6WzE2LjEzOTgwMTYyLDMzMjUzLjIsMTA4MzY0NjQ1LjU1MTg4MjUwXX0sIjEzMTAwODMyMDAiOnsidiI6WzE0LjgxMjY3OTcxLDM0ODk5LjEsMTAwMjY1OTE4LjAwNjAxMTc1LDEsNjc2ODkyNS4wMDAwMDAwMDAwMDAwMDAwMDAwMF0sImMiOlsxNC44MTI2Nzk3MSwzNDg5OS4xLDEwMDI2NTkxOC4wMDYwMTE3NV19LCIxMzEwNjg4MDAwIjp7InYiOlsxNC4wODgzNDgyOSwyNDgwNi45NCw5NjEyNTE1Mi41OTEzNzcyNSwxLDY4MjMwMjUuMDAwMDAwMDAwMDAwMDAwMDAwMDBdLCJjIjpbMTQuMDg4MzQ4MjksMjQ4MDYuOTQsOTYxMjUxNTIuNTkxMzc3MjVdfSwiMTMxMTIwNjQwMCI6eyJ2IjpbMTMuNzYyODYxOTgsMjQ5NTQuMTMsOTQ1NTA1MTcuNzMxMDUwNTAsMSw2ODY5OTc1LjAwMDAwMDAwMDAwMDAwMDAwMDAwXSwiYyI6WzEzLjc2Mjg2MTk4LDI0OTU0LjEzLDk0NTUwNTE3LjczMTA1MDUwXX0sIjEzMTE4MTEyMDAiOnsidiI6WzEzLjk1MTcwMzM1LDMyNjc2LjE1LDk2NjM4MjE3LjIxNjY5Mzc1LDEsNjkyNjYyNS4wMDAwMDAwMDAwMDAwMDAwMDAwMF0sImMiOlsxMy45NTE3MDMzNSwzMjY3Ni4xNSw5NjYzODIxNy4yMTY2OTM3NV19LCIxMzEyNDE2MDAwIjp7InYiOlsxMi4xNzcxMTU0Nyw1MDI1Ny45Nyw4NTAxMzYxOC4zNzAxNDQ3NSwxLDY5ODE0MjUuMDAwMDAwMDAwMDAwMDAwMDAwMDBdLCJjIjpbMTIuMTc3MTE1NDcsNTAyNTcuOTcsODUwMTM2MTguMzcwMTQ0NzVdfSwiMTMxMzAyMDgwMCI6eyJ2IjpbMTAuMTIwNTcxODUsNTgyNTQuODIsNzExNDEyOTQuNzQ4MDkzNzUsMSw3MDI5Mzc1LjAwMDAwMDAwMDAwMDAwMDAwMDAwXSwiYyI6WzEwLjEyMDU3MTg1LDU4MjU0LjgyLDcxMTQxMjk0Ljc0ODA5Mzc1XX0sIjEzMTM1MzkyMDAiOnsidiI6WzExLjUzMzIwMjMzLDIyODY0LjAyLDgxNTM1NDE1LjUyMjIyNjI1LDEsNzA2OTYyNS4wMDAwMDAwMDAwMDAwMDAwMDAwMF0sImMiOlsxMS41MzMyMDIzMywyMjg2NC4wMiw4MTUzNTQxNS41MjIyMjYyNV19LCIxMzE0MTQ0MDAwIjp7InYiOlsxMS40NzQzMTcwNSw3ODIwLjMsODE3MTg2NTEuNzQwNDY4NzUsMSw3MTIxODc1LjAwMDAwMDAwMDAwMDAwMDAwMDAwXSwiYyI6WzExLjQ3NDMxNzA1LDc4MjAuMyw4MTcxODY1MS43NDA0Njg3NV19LCIxMzE0NzQ4ODAwIjp7InYiOls5LjM3NTk2Njc5LDE5NjMyLjc4LDY3MjI0MDQxLjA5MDExMTc1LDEsNzE2OTgyNS4wMDAwMDAwMDAwMDAwMDAwMDAwMF0sImMiOls5LjM3NTk2Njc5LDE5NjMyLjc4LDY3MjI0MDQxLjA5MDExMTc1XX0sIjEzMTUzNTM2MDAiOnsidiI6WzguMjAzMzkyMDksNDk3MTIuODUsNTkyMjkyNDUuNjAxODcyMjgsMSw3MjIwMDkyLjAwMDAwMDAwMDAwMDAwMDAwMDAwXSwiYyI6WzguMjAzMzkyMDksNDk3MTIuODUsNTkyMjkyNDUuNjAxODcyMjhdfSwiMTMxNTk1ODQwMCI6eyJ2IjpbNS45NTY3NjQ3Myw0MzU4My44Niw0MzI5NTQwNC4xNjc5NDA3NSwxLDcyNjgyNzUuMDAwMDAwMDAwMDAwMDAwMDAwMDBdLCJjIjpbNS45NTY3NjQ3Myw0MzU4My44Niw0MzI5NTQwNC4xNjc5NDA3NV19LCIxMzE2NDc2ODAwIjp7InYiOls1LjI4ODczNTUxLDExNjg1MC43NywzODY2MDM2MC40MDg5MTE0NCwxLDczMDk5NDQuMDAwMDAwMDAwMDAwMDAwMDAwMDBdLCJjIjpbNS4yODg3MzU1MSwxMTY4NTAuNzcsMzg2NjAzNjAuNDA4OTExNDRdfSwiMTMxNzA4MTYwMCI6eyJ2IjpbNS4xNDM1MTk4OSwyNDcwNC4xNSwzNzg0NTg5MC43NjI2MjI3NSwxLDczNTc5NzUuMDAwMDAwMDAwMDAwMDAwMDAwMDBdLCJjIjpbNS4xNDM1MTk4OSwyNDcwNC4xNSwzNzg0NTg5MC43NjI2MjI3NV19LCIxMzE3Njg2NDAwIjp7InYiOls1LjA2MzQyNzQsMTU3OTAuNjYsMzc0ODgyMjQuMDI3MDY1MCwxLDc0MDM3MjUuMDAwMDAwMDAwMDAwMDAwMDAwMDBdLCJjIjpbNS4wNjM0Mjc0LDE1NzkwLjY2LDM3NDg4MjI0LjAyNzA2NTBdfSwiMTMxODI5MTIwMCI6eyJ2IjpbNC4xNjUzMTkyOCw0MTA0OC40NywzMTAyMDY5NC42NzI4OTAwMCwxLDc0NDczNzUuMDAwMDAwMDAwMDAwMDAwMDAwMDBdLCJjIjpbNC4xNjUzMTkyOCw0MTA0OC40NywzMTAyMDY5NC42NzI4OTAwMF19LCIxMzE4ODA5NjAwIjp7InYiOlszLjU5MDQ0MTYyLDIwODA1Mi45NywyNjg2OTYzNy4xNTMwNDU5NiwxLDc0ODM2NTguMDAwMDAwMDAwMDAwMDAwMDAwMDBdLCJjIjpbMy41OTA0NDE2MiwyMDgwNTIuOTcsMjY4Njk2MzcuMTUzMDQ1OTZdfSwiMTMxOTQxNDQwMCI6eyJ2IjpbMy4xNzYyNjczMSw5MjEyMS4zNywyMzkwMDg1NS42NjA5NzA3NSwxLDc1MjQ4MjUuMDAwMDAwMDAwMDAwMDAwMDAwMDBdLCJjIjpbMy4xNzYyNjczMSw5MjEyMS4zNywyMzkwMDg1NS42NjA5NzA3NV19LCIxMzIwMDE5MjAwIjp7InYiOlszLjYyMjAwMDEzLDMxMDgyLjUxLDI3NDAwODgzLjczMzQ2NjI1LDEsNzU2NTEyNS4wMDAwMDAwMDAwMDAwMDAwMDAwMF0sImMiOlszLjYyMjAwMDEzLDMxMDgyLjUxLDI3NDAwODgzLjczMzQ2NjI1XX0sIjEzMjA2MjQwMDAiOnsidiI6WzIuOTcxMDIyNTEsMjQxMjYuMjEsMjI2MjQzOTguODA1MTIyNzEsMSw3NjE1MDIxLjAwMDAwMDAwMDAwMDAwMDAwMDAwXSwiYyI6WzIuOTcxMDIyNTEsMjQxMjYuMjEsMjI2MjQzOTguODA1MTIyNzFdfSwiMTMyMTIyODgwMCI6eyJ2IjpbMy4wODExODc4NiwzODIwODUuMzgsMjM2MTcyMjEuNzU0ODI3NzgsMSw3NjY0OTczLjAwMDAwMDAwMDAwMDAwMDAwMDAwXSwiYyI6WzMuMDgxMTg3ODYsMzgyMDg1LjM4LDIzNjE3MjIxLjc1NDgyNzc4XX0sIjEzMjE3NDcyMDAiOnsidiI6WzIuMzI0NDc0MjUsNzk4MzEuMjEsMTc5MTQ0MzIuNDg1NDY4NzUsMSw3NzA2ODc1LjAwMDAwMDAwMDAwMDAwMDAwMDAwXSwiYyI6WzIuMzI0NDc0MjUsNzk4MzEuMjEsMTc5MTQ0MzIuNDg1NDY4NzVdfSwiMTMyMjM1MjAwMCI6eyJ2IjpbMi41Mjg0OTg3NywyMjc2NC43NCwxOTU5NzQwMi43OTQ3NTIxNiwxLDc3NTA2MDguMDAwMDAwMDAwMDAwMDAwMDAwMDBdLCJjIjpbMi41Mjg0OTg3NywyMjc2NC43NCwxOTU5NzQwMi43OTQ3NTIxNl19LCIxMzIyOTU2ODAwIjp7InYiOlsyLjk2Mzc3MTEzLDk1MTU1LjEzLDIzMTI1NTY1LjE4NDYwNzUwLDEsNzgwMjc1MC4wMDAwMDAwMDAwMDAwMDAwMDAwMF0sImMiOlsyLjk2Mzc3MTEzLDk1MTU1LjEzLDIzMTI1NTY1LjE4NDYwNzUwXX0sIjEzMjM1NjE2MDAiOnsidiI6WzMuMDUxNDI3MzUsMTA4NjU5LDIzOTczMzIyLjMyMzkzMzE1LDEsNzg1NjQyOS4wMDAwMDAwMDAwMDAwMDAwMDAwMF0sImMiOlszLjA1MTQyNzM1LDEwODY1OSwyMzk3MzMyMi4zMjM5MzMxNV19LCIxMzI0MDgwMDAwIjp7InYiOlszLjIxMjgxOTg1LDE2NDUwLjk4LDI1MzY4NjY2LjQ5NzA4ODc1LDEsNzg5NjA3NS4wMDAwMDAwMDAwMDAwMDAwMDAwMF0sImMiOlszLjIxMjgxOTg1LDE2NDUwLjk4LDI1MzY4NjY2LjQ5NzA4ODc1XX0sIjEzMjQ2ODQ4MDAiOnsidiI6WzMuOTg1MDk0NjYsMTQ5MDIuMzYsMzE2Njk2NjIuODMwNzY1MTQsMSw3OTQ3MDI5LjAwMDAwMDAwMDAwMDAwMDAwMDAwXSwiYyI6WzMuOTg1MDk0NjYsMTQ5MDIuMzYsMzE2Njk2NjIuODMwNzY1MTRdfSwiMTMyNTI4OTYwMCI6eyJ2IjpbNC4zMjA3MzA0MiwxMjkyMDEuNzEsMzQ1NzExMzYuMjU0NzY0NTAsMSw4MDAxMjI1LjAwMDAwMDAwMDAwMDAwMDAwMDAwXSwiYyI6WzQuMzIwNzMwNDIsMTI5MjAxLjcxLDM0NTcxMTM2LjI1NDc2NDUwXX0sIjEzMjU4OTQ0MDAiOnsidiI6WzYuNjA4MDIyNDQsNDgzODUuNDksNTMyNDAzNDEuMTk3Mzk3MDAsMSw4MDU2OTI1LjAwMDAwMDAwMDAwMDAwMDAwMDAwXSwiYyI6WzYuNjA4MDIyNDQsNDgzODUuNDksNTMyNDAzNDEuMTk3Mzk3MDBdfSwiMTMyNjQ5OTIwMCI6eyJ2IjpbNi40MzIxNjQ5LDE0MTY2NC43Niw1MjE2NTk5NS44MzIxODczLDEsODExMDE3Ny4wMDAwMDAwMDAwMDAwMDAwMDAwMF0sImMiOls2LjQzMjE2NDksMTQxNjY0Ljc2LDUyMTY1OTk1LjgzMjE4NzNdfSwiMTMyNzAxNzYwMCI6eyJ2IjpbNi42OTEyMjM5NCw2Njg0NS45NSw1NDU2NjE5NS4xOTYwNjY2MCwxLDgxNTQ4OTAuMDAwMDAwMDAwMDAwMDAwMDAwMDBdLCJjIjpbNi42OTEyMjM5NCw2Njg0NS45NSw1NDU2NjE5NS4xOTYwNjY2MF19LCIxMzI3NjIyNDAwIjp7InYiOls1Ljg1MzYzNzg0LDExNTMwNC41Nyw0ODAzOTE5Ni4wMDI0NzQwMCwxLDgyMDY3MjUuMDAwMDAwMDAwMDAwMDAwMDAwMDBdLCJjIjpbNS44NTM2Mzc4NCwxMTUzMDQuNTcsNDgwMzkxOTYuMDAyNDc0MDBdfSwiMTMyODIyNzIwMCI6eyJ2IjpbNi4wOTM5MTQ0Niw1ODk5My42OCw1MDM0MzUxNS4zNjgzNjU0MiwxLDgyNjEyNzcuMDAwMDAwMDAwMDAwMDAwMDAwMDBdLCJjIjpbNi4wOTM5MTQ0Niw1ODk5My42OCw1MDM0MzUxNS4zNjgzNjU0Ml19LCIxMzI4ODMyMDAwIjp7InYiOls1Ljg0MTI1NzUxLDM5MjU1LjQ3LDQ4NTUxMzY0LjE3MTYxODAwLDEsODMxMTgwMC4wMDAwMDAwMDAwMDAwMDAwMDAwMF0sImMiOls1Ljg0MTI1NzUxLDM5MjU1LjQ3LDQ4NTUxMzY0LjE3MTYxODAwXX0sIjEzMjkzNTA0MDAiOnsidiI6WzUuMTg0MzY2NDksMTY2NTM0Ljk1LDQzMzEzMTM3LjE5MzI1OTgzLDEsODM1NDU2Ny4wMDAwMDAwMDAwMDAwMDAwMDAwMF0sImMiOls1LjE4NDM2NjQ5LDE2NjUzNC45NSw0MzMxMzEzNy4xOTMyNTk4M119LCIxMzI5OTU1MjAwIjp7InYiOls0LjQ0NjI0MjQ5LDE2NDU5Mi4xMSwzNzM4NTQ1MS44ODQ3MjkyNSwxLDg0MDgzMjUuMDAwMDAwMDAwMDAwMDAwMDAwMDBdLCJjIjpbNC40NDYyNDI0OSwxNjQ1OTIuMTEsMzczODU0NTEuODg0NzI5MjVdfSwiMTMzMDU2MDAwMCI6eyJ2IjpbNC45NjQ1MDQ4MSw0NDI1MS4xMSw0MjAxODIwMy40NzMwMTcyNSwxLDg0NjM3MjUuMDAwMDAwMDAwMDAwMDAwMDAwMDBdLCJjIjpbNC45NjQ1MDQ4MSw0NDI1MS4xMSw0MjAxODIwMy40NzMwMTcyNV19LCIxMzMxMTY0ODAwIjp7InYiOls1LjAyMjY1Mjg1LDU4MDg4LjQyLDQyNzU1MTU2LjU5Mjc3NTI1LDEsODUxMjQ2NS4wMDAwMDAwMDAwMDAwMDAwMDAwMF0sImMiOls1LjAyMjY1Mjg1LDU4MDg4LjQyLDQyNzU1MTU2LjU5Mjc3NTI1XX0sIjEzMzE3Njk2MDAiOnsidiI6WzUuMzgxMzcwNzQsNDEwNTQuNTMsNDYwOTE4NDMuOTkwOTA1NTAsMSw4NTY1MDc1LjAwMDAwMDAwMDAwMDAwMDAwMDAwXSwiYyI6WzUuMzgxMzcwNzQsNDEwNTQuNTMsNDYwOTE4NDMuOTkwOTA1NTBdfSwiMTMzMjI4ODAwMCI6eyJ2IjpbNS4wOTgwODE3Myw0NjQ3NS44OCw0MzkwNTg1Ny41MTU2Mzk2MywxLDg2MTIyMzEuMDAwMDAwMDAwMDAwMDAwMDAwMDBdLCJjIjpbNS4wOTgwODE3Myw0NjQ3NS44OCw0MzkwNTg1Ny41MTU2Mzk2M119LCIxMzMyODkyODAwIjp7InYiOls0LjgwMzU3OTk0LDM3OTgzLjY5LDQxNjI5NjI1LjEwMjUxNzUwLDEsODY2NjM3NS4wMDAwMDAwMDAwMDAwMDAwMDAwMF0sImMiOls0LjgwMzU3OTk0LDM3OTgzLjY5LDQxNjI5NjI1LjEwMjUxNzUwXX0sIjEzMzM0OTc2MDAiOnsidiI6WzUuMDAyMDUxODQsNTEwNzMuNjQsNDM1OTgwMDguODg4NzM2MDAsMSw4NzE2MDI1LjAwMDAwMDAwMDAwMDAwMDAwMDAwXSwiYyI6WzUuMDAyMDUxODQsNTEwNzMuNjQsNDM1OTgwMDguODg4NzM2MDBdfSwiMTMzNDEwMjQwMCI6eyJ2IjpbNC44MjE1MzQ2LDY3MTkzLjY3LDQyMjU3NDc2Ljk0NzAwNjYsMSw4NzY0MzIxLjAwMDAwMDAwMDAwMDAwMDAwMDAwXSwiYyI6WzQuODIxNTM0Niw2NzE5My42Nyw0MjI1NzQ3Ni45NDcwMDY2XX0sIjEzMzQ2MjA4MDAiOnsidiI6WzQuOTQ4Mzg1NjcsMzA2ODUuMzEsNDM1NjI0OTQuNjk3NjM2MjUsMSw4ODAzMzc1LjAwMDAwMDAwMDAwMDAwMDAwMDAwXSwiYyI6WzQuOTQ4Mzg1NjcsMzA2ODUuMzEsNDM1NjI0OTQuNjk3NjM2MjVdfSwiMTMzNTIyNTYwMCI6eyJ2IjpbNS4xNTUxOTgwNSw3MDc0NS45Myw0NTY0MjcyNi40NzYwMjg0NSwxLDg4NTM3MjkuMDAwMDAwMDAwMDAwMDAwMDAwMDBdLCJjIjpbNS4xNTUxOTgwNSw3MDc0NS45Myw0NTY0MjcyNi40NzYwMjg0NV19LCIxMzM1ODMwNDAwIjp7InYiOls1LjAwNTcxMDc1LDM2NDkxLjIxLDQ0NTkzNzI5LjYyMTgzODI1LDEsODkwODU3MS4wMDAwMDAwMDAwMDAwMDAwMDAwMF0sImMiOls1LjAwNTcxMDc1LDM2NDkxLjIxLDQ0NTkzNzI5LjYyMTgzODI1XX0sIjEzMzY0MzUyMDAiOnsidiI6WzUuMDc3NDY0MDUsNjgyNzIuNTMsNDU1MjM5MDcuOTg5MjkzNzUsMSw4OTY1ODc1LjAwMDAwMDAwMDAwMDAwMDAwMDAwXSwiYyI6WzUuMDc3NDY0MDUsNjgyNzIuNTMsNDU1MjM5MDcuOTg5MjkzNzVdfSwiMTMzNzA0MDAwMCI6eyJ2IjpbNS4wMDg4NTg0Nyw0Mzk4Ny4wNSw0NTE1Mjg5NS42MzQ1Mjk3NiwxLDkwMTQ2MDguMDAwMDAwMDAwMDAwMDAwMDAwMDBdLCJjIjpbNS4wMDg4NTg0Nyw0Mzk4Ny4wNSw0NTE1Mjg5NS42MzQ1Mjk3Nl19LCIxMzM3NTU4NDAwIjp7InYiOls1LjExNzk4MjM0LDMzNzY3LjQyLDQ2MzM5OTkzLjE2NDIxNDMyLDEsOTA1NDM0OC4wMDAwMDAwMDAwMDAwMDAwMDAwMF0sImMiOls1LjExNzk4MjM0LDMzNzY3LjQyLDQ2MzM5OTkzLjE2NDIxNDMyXX0sIjEzMzgxNjMyMDAiOnsidiI6WzUuMTQ0MDc1NTEsMjc1MzcuOTIsNDY4MTY0MjYuNjkxMzc5MzgsMSw5MTAxMDM4LjAwMDAwMDAwMDAwMDAwMDAwMDAwXSwiYyI6WzUuMTQ0MDc1NTEsMjc1MzcuOTIsNDY4MTY0MjYuNjkxMzc5MzhdfSwiMTMzODc2ODAwMCI6eyJ2IjpbNS4xOTg2NDQ2Miw1MTI0OC42NCw0NzU3NzAyMy40MTU2OTYwNiwxLDkxNTE4MTMuMDAwMDAwMDAwMDAwMDAwMDAwMDBdLCJjIjpbNS4xOTg2NDQ2Miw1MTI0OC42NCw0NzU3NzAyMy40MTU2OTYwNl19LCIxMzM5MzcyODAwIjp7InYiOls1LjQ3MDQyMDQyLDQwMTM3LjIzLDUwMzUzNDQyLjA3OTQ2MzUwLDEsOTIwNDY3NS4wMDAwMDAwMDAwMDAwMDAwMDAwMF0sImMiOls1LjQ3MDQyMDQyLDQwMTM3LjIzLDUwMzUzNDQyLjA3OTQ2MzUwXX0sIjEzMzk4OTEyMDAiOnsidiI6WzYuMzIyOTQ4NDcsNDg3MjAuMDQsNTg0OTc4MjYuMzQ4NDk2NDMsMSw5MjUxNjY5LjAwMDAwMDAwMDAwMDAwMDAwMDAwXSwiYyI6WzYuMzIyOTQ4NDcsNDg3MjAuMDQsNTg0OTc4MjYuMzQ4NDk2NDNdfSwiMTM0MDQ5NjAwMCI6eyJ2IjpbNi41MTE4NjA1NCwzMzgwNy4xNiw2MDU4MjcyOS44Njk2OTk3NiwxLDkzMDM0NDQuMDAwMDAwMDAwMDAwMDAwMDAwMDBdLCJjIjpbNi41MTE4NjA1NCwzMzgwNy4xNiw2MDU4MjcyOS44Njk2OTk3Nl19LCIxMzQxMTAwODAwIjp7InYiOls2LjY4MDU4Mjk1LDIwNjY5LjQsNjI0OTQyOTQuODMzOTgwMTUsMSw5MzU0NjE3LjAwMDAwMDAwMDAwMDAwMDAwMDAwXSwiYyI6WzYuNjgwNTgyOTUsMjA2NjkuNCw2MjQ5NDI5NC44MzM5ODAxNV19LCIxMzQxNzA1NjAwIjp7InYiOls2Ljc1MDI1ODMsMTgxNTEuODQsNjM1MTA2NDguOTk3ODM3NSwxLDk0MDg2MjUuMDAwMDAwMDAwMDAwMDAwMDAwMDBdLCJjIjpbNi43NTAyNTgzLDE4MTUxLjg0LDYzNTEwNjQ4Ljk5NzgzNzVdfSwiMTM0MjMxMDQwMCI6eyJ2IjpbNy42NDI0Mzg0MiwyNjg4OS41OSw3MjMwODMxMi4wNzMzMTc5OCwxLDk0NjE0MTkuMDAwMDAwMDAwMDAwMDAwMDAwMDBdLCJjIjpbNy42NDI0Mzg0MiwyNjg4OS41OSw3MjMwODMxMi4wNzMzMTc5OF19LCIxMzQyODI4ODAwIjp7InYiOls4LjUzNzkwODksMTM5NDAzLjg0LDgxMTY3Njk3LjEzMTgwMzgsMSw5NTA2NzQyLjAwMDAwMDAwMDAwMDAwMDAwMDAwXSwiYyI6WzguNTM3OTA4OSwxMzk0MDMuODQsODExNjc2OTcuMTMxODAzOF19LCIxMzQzNDMzNjAwIjp7InYiOls4LjkxNzk5OTcyLDE2MTY3LjQyLDg1Mjc4NzI5LjA0MjQ4ODgwLDEsOTU2MjU0MC4wMDAwMDAwMDAwMDAwMDAwMDAwMF0sImMiOls4LjkxNzk5OTcyLDE2MTY3LjQyLDg1Mjc4NzI5LjA0MjQ4ODgwXX0sIjEzNDQwMzg0MDAiOnsidiI6WzEwLjY3OTk3MTk1LDUyNDA5LjIzLDEwMjcwOTQyOS4wODI3ODUzNSwxLDk2MTcwMTMuMDAwMDAwMDAwMDAwMDAwMDAwMDBdLCJjIjpbMTAuNjc5OTcxOTUsNTI0MDkuMjMsMTAyNzA5NDI5LjA4Mjc4NTM1XX0sIjEzNDQ2NDMyMDAiOnsidiI6WzExLjU3MjU3NTU5LDIxNzExLjQ3LDExMTkzMTU3MS4yNjcwNjI2MCwxLDk2NzIxNDAuMDAwMDAwMDAwMDAwMDAwMDAwMDBdLCJjIjpbMTEuNTcyNTc1NTksMjE3MTEuNDcsMTExOTMxNTcxLjI2NzA2MjYwXX0sIjEzNDUxNjE2MDAiOnsidiI6WzEzLjQ1NDIwNzg3LDIyMDY5Ny44LDEzMDc2MTEwOS45MzMzMzMyNSwxLDk3MTg5NzUuMDAwMDAwMDAwMDAwMDAwMDAwMDBdLCJjIjpbMTMuNDU0MjA3ODcsMjIwNjk3LjgsMTMwNzYxMTA5LjkzMzMzMzI1XX0sIjEzNDU3NjY0MDAiOnsidiI6WzEwLjIwNTUyMDI2LDkyMTUzLjQsOTk3NzI5OTMuMTMxODU3NTAsMSw5Nzc2Mzc1LjAwMDAwMDAwMDAwMDAwMDAwMDAwXSwiYyI6WzEwLjIwNTUyMDI2LDkyMTUzLjQsOTk3NzI5OTMuMTMxODU3NTBdfSwiMTM0NjM3MTIwMCI6eyJ2IjpbMTAuODg4NzMyNTgsNjc2OTAuNTIsMTA3MDM2ODk0LjU4NTM1NDgwLDEsOTgzMDA2MC4wMDAwMDAwMDAwMDAwMDAwMDAwMF0sImMiOlsxMC44ODg3MzI1OCw2NzY5MC41MiwxMDcwMzY4OTQuNTg1MzU0ODBdfSwiMTM0Njk3NjAwMCI6eyJ2IjpbMTAuOTQ5Njg1MjYsMzU1MDcuMTksMTA4MjY3NzUwLjQyOTU2NTAwLDEsOTg4Nzc1MC4wMDAwMDAwMDAwMDAwMDAwMDAwMF0sImMiOlsxMC45NDk2ODUyNiwzNTUwNy4xOSwxMDgyNjc3NTAuNDI5NTY1MDBdfSwiMTM0NzU4MDgwMCI6eyJ2IjpbMTEuNDM4NTY3NCw0MzMxNS44NywxMTM3MDA3ODkuNzc2OTI1MCwxLDk5NDAxMjUuMDAwMDAwMDAwMDAwMDAwMDAwMDBdLCJjIjpbMTEuNDM4NTY3NCw0MzMxNS44NywxMTM3MDA3ODkuNzc2OTI1MF19LCIxMzQ4MDk5MjAwIjp7InYiOlsxMi40NzUwNzkwNiwzMjU3Ni40NiwxMjQ1ODQ4NzIuMDQ4NTAyMDAsMSw5OTg2NzAwLjAwMDAwMDAwMDAwMDAwMDAwMDAwXSwiYyI6WzEyLjQ3NTA3OTA2LDMyNTc2LjQ2LDEyNDU4NDg3Mi4wNDg1MDIwMF19LCIxMzQ4NzA0MDAwIjp7InYiOlsxMi4yODk1MjY1NSwxOTMxMC40NCwxMjMzOTUxNDEuOTkyNDIxMjUsMSwxMDA0MDY3NS4wMDAwMDAwMDAwMDAwMDAwMDAwMF0sImMiOlsxMi4yODk1MjY1NSwxOTMxMC40NCwxMjMzOTUxNDEuOTkyNDIxMjVdfSwiMTM0OTMwODgwMCI6eyJ2IjpbMTIuODk1ODYwMjcsMzc5NjcuNjQsMTMwMTQzNDA5Ljg2MjMwNjI1LDEsMTAwOTE4NzUuMDAwMDAwMDAwMDAwMDAwMDAwMDBdLCJjIjpbMTIuODk1ODYwMjcsMzc5NjcuNjQsMTMwMTQzNDA5Ljg2MjMwNjI1XX0sIjEzNDk5MTM2MDAiOnsidiI6WzEyLjE2MjA1MTMsMTk3NjkuNzcsMTIzMzYwMDg3LjY4MzU5MjksMSwxMDE0MzAzMy4wMDAwMDAwMDAwMDAwMDAwMDAwMF0sImMiOlsxMi4xNjIwNTEzLDE5NzY5Ljc3LDEyMzM2MDA4Ny42ODM1OTI5XX0sIjEzNTA0MzIwMDAiOnsidiI6WzExLjkwNDIzNDM3LDIzNTUyLjc1LDEyMTI3NTA1NC4yODE0OTk3MiwxLDEwMTg3NTU2LjAwMDAwMDAwMDAwMDAwMDAwMDAwXSwiYyI6WzExLjkwNDIzNDM3LDIzNTUyLjc1LDEyMTI3NTA1NC4yODE0OTk3Ml19LCIxMzUxMDM2ODAwIjp7InYiOlsxMS42ODkzMzIzNCwyMTcxOS42NCwxMTk3MDU0MzcuNzcwMzY2MTQsMSwxMDI0MDU3MS4wMDAwMDAwMDAwMDAwMDAwMDAwMF0sImMiOlsxMS42ODkzMzIzNCwyMTcxOS42NCwxMTk3MDU0MzcuNzcwMzY2MTRdfSwiMTM1MTY0MTYwMCI6eyJ2IjpbMTAuOTIyNDE3ODEsNDA3NTAuNTksMTEyNDQ3NDA1LjQ0MDU2NjYyLDEsMTAyOTUxMDIuMDAwMDAwMDAwMDAwMDAwMDAwMDBdLCJjIjpbMTAuOTIyNDE3ODEsNDA3NTAuNTksMTEyNDQ3NDA1LjQ0MDU2NjYyXX0sIjEzNTIyNDY0MDAiOnsidiI6WzEwLjkzMjYyNDQ1LDMxNzMwLjU3LDExMzExOTQyNy44NzkxNzIwMCwxLDEwMzQ2OTYwLjAwMDAwMDAwMDAwMDAwMDAwMDAwXSwiYyI6WzEwLjkzMjYyNDQ1LDMxNzMwLjU3LDExMzExOTQyNy44NzkxNzIwMF19LCIxMzUyODUxMjAwIjp7InYiOlsxMS4xNjcyNjc2MSwyNDU0OC4yNiwxMTYxMTIxNzguNjY5Mjg1MDYsMSwxMDM5NzU0Ni4wMDAwMDAwMDAwMDAwMDAwMDAwMF0sImMiOlsxMS4xNjcyNjc2MSwyNDU0OC4yNiwxMTYxMTIxNzguNjY5Mjg1MDZdfSwiMTM1MzM2OTYwMCI6eyJ2IjpbMTEuODExMzcwODEsMjcyNjAuNzEsMTIzMzE1NDEyLjE4MTk4MjM4LDEsMTA0NDAzOTguMDAwMDAwMDAwMDAwMDAwMDAwMDBdLCJjIjpbMTEuODExMzcwODEsMjcyNjAuNzEsMTIzMzE1NDEyLjE4MTk4MjM4XX0sIjEzNTM5NzQ0MDAiOnsidiI6WzEyLjM5MDMyNTgzLDMzMjUyLjU3LDEzMDAxOTQzMi44ODc4MzM3NSwxLDEwNDkzNjI1LjAwMDAwMDAwMDAwMDAwMDAwMDAwXSwiYyI6WzEyLjM5MDMyNTgzLDMzMjUyLjU3LDEzMDAxOTQzMi44ODc4MzM3NV19LCIxMzU0NTc5MjAwIjp7InYiOlsxMi42NzcwNDgxLDYzMTgzLjU4LDEzMzM5NTk1MC4wMzM3NDM1LDEsMTA1MjI2MzUuMDAwMDAwMDAwMDAwMDAwMDAwMDBdLCJjIjpbMTIuNjc3MDQ4MSw2MzE4My41OCwxMzMzOTU5NTAuMDMzNzQzNV19LCIxMzU1MTg0MDAwIjp7InYiOlsxMy40ODgyNzUxMywyODAzNCwxNDIyNDg5NDEuMTM3NDQ1MzQsMSwxMDU0NjExOC4wMDAwMDAwMDAwMDAwMDAwMDAwMF0sImMiOlsxMy40ODgyNzUxMywyODAzNCwxNDIyNDg5NDEuMTM3NDQ1MzRdfSwiMTM1NTcwMjQwMCI6eyJ2IjpbMTMuNjIxMTEyNzcsNjM0NzkuNzgsMTQzODk4MDM5LjIzODM5NjI2LDEsMTA1NjQzMzguMDAwMDAwMDAwMDAwMDAwMDAwMDBdLCJjIjpbMTMuNjIxMTEyNzcsNjM0NzkuNzgsMTQzODk4MDM5LjIzODM5NjI2XX0sIjEzNTYzMDcyMDAiOnsidiI6WzEzLjMxNzc1NzMzLDE2NzE2LjE1LDE0MDk5NDU1MC44MjQ2NTk0NywxLDEwNTg2OTU5LjAwMDAwMDAwMDAwMDAwMDAwMDAwXSwiYyI6WzEzLjMxNzc1NzMzLDE2NzE2LjE1LDE0MDk5NDU1MC44MjQ2NTk0N119LCIxMzU2OTEyMDAwIjp7InYiOlsxMy40ODM3MzI4NiwxNDk5Ny45MSwxNDMxMTI1MzguMTYzMzczNDgsMSwxMDYxMzcxOC4wMDAwMDAwMDAwMDAwMDAwMDAwMF0sImMiOlsxMy40ODM3MzI4NiwxNDk5Ny45MSwxNDMxMTI1MzguMTYzMzczNDhdfSwiMTM1NzUxNjgwMCI6eyJ2IjpbMTMuNTMyMTEwNTQsMjU0NDUuMTEsMTQzOTkzMTMxLjM3NTMzNzkyLDEsMTA2NDA4NDguMDAwMDAwMDAwMDAwMDAwMDAwMDBdLCJjIjpbMTMuNTMyMTEwNTQsMjU0NDUuMTEsMTQzOTkzMTMxLjM3NTMzNzkyXX0sIjEzNTgxMjE2MDAiOnsidiI6WzE0LjMwNDMwOTA0LDIxOTk2LjMzLDE1MjU0NTY1Ny40NTk5MDc2MCwxLDEwNjY0MzE1LjAwMDAwMDAwMDAwMDAwMDAwMDAwXSwiYyI6WzE0LjMwNDMwOTA0LDIxOTk2LjMzLDE1MjU0NTY1Ny40NTk5MDc2MF19LCIxMzU4NjQwMDAwIjp7InYiOlsxNS42NTUzMTk0NSwyNTk4My4wMSwxNjcyNTM0NDguNzkwODgwNTAsMSwxMDY4MzQ5MC4wMDAwMDAwMDAwMDAwMDAwMDAwMF0sImMiOlsxNS42NTUzMTk0NSwyNTk4My4wMSwxNjcyNTM0NDguNzkwODgwNTBdfSwiMTM1OTI0NDgwMCI6eyJ2IjpbMTguNDgxNTg3NywyMzgzNi4yNiwxOTc5MTE3MDguMjY1MTY3NiwxLDEwNzA4NTg4LjAwMDAwMDAwMDAwMDAwMDAwMDAwXSwiYyI6WzE4LjQ4MTU4NzcsMjM4MzYuMjYsMTk3OTExNzA4LjI2NTE2NzZdfSwiMTM1OTg0OTYwMCI6eyJ2IjpbMTkuNjM3MjAwNDMsMzQxMjUuNywyMTA4NDM2OTguMDY4NDg5NzksMSwxMDczNjk1My4wMDAwMDAwMDAwMDAwMDAwMDAwMF0sImMiOlsxOS42MzcyMDA0MywzNDEyNS43LDIxMDg0MzY5OC4wNjg0ODk3OV19LCIxMzYwNDU0NDAwIjp7InYiOlsyMy42MTcwODcyOSw1NjM4Ni4zNSwyNTQyMTcyMzIuNDkxMjk2NjcsMSwxMDc2NDEyMy4wMDAwMDAwMDAwMDAwMDAwMDAwMF0sImMiOlsyMy42MTcwODcyOSw1NjM4Ni4zNSwyNTQyMTcyMzIuNDkxMjk2NjddfSwiMTM2MDk3MjgwMCI6eyJ2IjpbMjcuMTAxMzEwMDQsMTg3NzQuMjYsMjkyMzkyMTg1LjYzNTUzNDMyLDEsMTA3ODg4NTguMDAwMDAwMDAwMDAwMDAwMDAwMDBdLCJjIjpbMjcuMTAxMzEwMDQsMTg3NzQuMjYsMjkyMzkyMTg1LjYzNTUzNDMyXX0sIjEzNjE1Nzc2MDAiOnsidiI6WzMwLjIxMjEzNTA4LDcxOTkyLjExLDMyNjg2Nzk4OS43OTU0ODc2OCwxLDEwODE5MDk2LjAwMDAwMDAwMDAwMDAwMDAwMDAwXSwiYyI6WzMwLjIxMjEzNTA4LDcxOTkyLjExLDMyNjg2Nzk4OS43OTU0ODc2OF19LCIxMzYyMTgyNDAwIjp7InYiOlszNC4wNjU4NTY1NSwzNjc0OC43NywzNjk1NzE1NTIuNDU2NTMzOTAsMSwxMDg0ODczOC4wMDAwMDAwMDAwMDAwMDAwMDAwMF0sImMiOlszNC4wNjU4NTY1NSwzNjc0OC43NywzNjk1NzE1NTIuNDU2NTMzOTBdfSwiMTM2Mjc4NzIwMCI6eyJ2IjpbNDQuMDY5MTkzNCw0NDU2Mi41Myw0NzkzMzE4NDYuODQyMzEzNCwxLDEwODc2ODAxLjAwMDAwMDAwMDAwMDAwMDAwMDAwXSwiYyI6WzQ0LjA2OTE5MzQsNDQ1NjIuNTMsNDc5MzMxODQ2Ljg0MjMxMzRdfSwiMTM2MzM5MjAwMCI6eyJ2IjpbNDYuODM0MDg2MzcsMTYzNDQuMDksNTEwNzY5NjQyLjIzNzg2NTA2LDEsMTA5MDU5MzguMDAwMDAwMDAwMDAwMDAwMDAwMDBdLCJjIjpbNDYuODM0MDg2MzcsMTYzNDQuMDksNTEwNzY5NjQyLjIzNzg2NTA2XX0sIjEzNjM5MTA0MDAiOnsidiI6WzY2LjU3Mzc1NTA5LDczMTAzLjI4LDcyODA5MTM5NS4zNzYxMTAxNywxLDEwOTM2NjEzLjAwMDAwMDAwMDAwMDAwMDAwMDAwXSwiYyI6WzY2LjU3Mzc1NTA5LDczMTAzLjI4LDcyODA5MTM5NS4zNzYxMTAxN119LCIxMzY0NTE1MjAwIjp7InYiOls4Ni4zOTQ1NzkxMiw4MzIzNy41OSw5NDc0MjgwMDkuMDU3ODY0ODAsMSw